user_input,reference_contexts,reference,synthesizer_name
What services are provided by Дилеры ООО «Киа Россия и СНГ» for Kia car owners?,"['Сервисная книжка Добро пожаловать в Семью Владельцев автомобилей Kia При выборе автомобиля Вы мечтали о надежном, безопасном, эргономичном и динамичном автомобиле? Ваша мечта сбылась! Все сотрудники корпорации Kia поздравляют Вас с приобретением автомобиля Kia. Вы стали Владельцем автомобиля, который является предметом нашей гордости. Самые новейшие технологии, применяемые в современном автомобилестроении, позволили создать высококачественный автомобиль, который будет доставлять удовольствие самому взыскательному водителю. Мы уверены в том, что автомобиль Kia будет оставаться надежным спутником в Вашей динамичной жизни на протяжении всего срока службы. Уверенность в надежности выпускаемых нами автомобилей позволяет гарантировать исправную работу узлов и агрегатов в течение 5 лет (7 лет для K900) или 150 000 км пробега (в зависимости от того, что наступит ранее) при соблюдении Вами условий, изложенных в Руководстве по эксплуатации автомобиля, и в данной сервисной книжке. Срок службы автомобиля Kia составляет 6 лет (7 лет для K900) или 180 000 км пробега, в зависимости от того, что наступит раньше. Специалисты Дилерской сети, обладающие необходимыми знаниями и опытом работы, возьмут на себя Техническое Обслуживание Вашего автомобиля и устранение возможных неисправностей, используя только детали, рекомендованные к применению корпорацией Kia. Дилеры ООО «Киа Россия и СНГ» позаботятся о том, чтобы Ваш автомобиль удовлетворял самым высоким требованиям. Корпорация Kia стремится к постоянному совершенствованию своей продукции и в связи с этим оставляет за собой право на изменение условий и положений, упомянутых в данной Сервисной книжке, с предварительным уведомлением об этом или без такого уведомления (в том числе посредством размещения информации на официальном сайте www.kia.ru, в связи с чем просим Вас отслеживать всю необходимую информацию, касающуюся Вашего автомобиля). Корпорация Kia не ограничивается продажей автомобилей, а постоянно стремится к расширению Дилерской сети на территории России, специалисты которой в любой момент готовы оказать Вам квалифицированную помощь и обеспечить необходимыми запасными частями и аксессуарами. Мы берем на себя обязательства обеспечить Вам комфорт при эксплуатации автомобилей Kia на протяжении многих лет. Каждый автомобиль, произведенный корпорацией Kia, покидая стены завода, проходит строгий выходной контроль качества, но тем не менее при передаче Вам автомобиля официальный Дилер должен провести его Предпродажное сервисное обслуживание (далее ПСО). Задачей ПСО является выявление и устранение возможных неисправностей, возникших в процессе транспортировки и хранения автомобиля до момента его продажи. После выполнения ПСО официальный Дилер заверит печатью Бланк ПСО на стр. 24. Внимание! Без проведения Предпродажной подготовки реализация автомобиля запрещена. Официальный Дилер, прежде чем передать Вам автомобиль, должен убедиться в том, что Вы полностью ознакомлены с его устройством и управлением: • объяснить Вам работу всех элементов управления автомобиля и дать возможность проверить их действие; • вписать информацию об автомобиле и его Владельце в соответствующие разделы Сервисной книжки; • убедиться в том, что Вы получили Руководство пользователя и объяснить требования к плановому Техническому Обслуживанию; • объяснить условия гарантийных обязательств корпорации Kia, распространяющиеся на новые автомобили и изложенные в настоящей Сервисной книжке. После ознакомления с вышеуказанной информацией Вам необходимо расписаться в соответствующем разделе Сервисной книжки. Дилер вправе отказать Владельцу автомобиля в гарантийном обслуживании в случае отсутствия подписи Владельца автомобиля на стр. 12 Сервисной книжки, свидетельствующей о том, что с гарантийными обязательствами он ознакомлен, условия предоставления гарантии и правила эксплуатации автомобиля разъяснены и понятны.']","Дилеры ООО «Киа Россия и СНГ» provide technical maintenance for Kia cars, ensuring the use of recommended parts. They guarantee the proper functioning of components for 5 years (7 years for K900) or 150,000 km, with the car's service life being 6 years (7 years for K900) or 180,000 km. The dealers aim to meet high standards, offering qualified assistance, spare parts, and accessories. They also conduct pre-sale service to identify and rectify any issues before delivering the vehicle to the owner.",single_hop_specific_query_synthesizer
What are the terms and conditions outlined in the Руководстве по эксплуатации for Kia vehicles?,"['Сервисная книжка Добро пожаловать в Семью Владельцев автомобилей Kia При выборе автомобиля Вы мечтали о надежном, безопасном, эргономичном и динамичном автомобиле? Ваша мечта сбылась! Все сотрудники корпорации Kia поздравляют Вас с приобретением автомобиля Kia. Вы стали Владельцем автомобиля, который является предметом нашей гордости. Самые новейшие технологии, применяемые в современном автомобилестроении, позволили создать высококачественный автомобиль, который будет доставлять удовольствие самому взыскательному водителю. Мы уверены в том, что автомобиль Kia будет оставаться надежным спутником в Вашей динамичной жизни на протяжении всего срока службы. Уверенность в надежности выпускаемых нами автомобилей позволяет гарантировать исправную работу узлов и агрегатов в течение 5 лет (7 лет для K900) или 150 000 км пробега (в зависимости от того, что наступит ранее) при соблюдении Вами условий, изложенных в Руководстве по эксплуатации автомобиля, и в данной сервисной книжке. Срок службы автомобиля Kia составляет 6 лет (7 лет для K900) или 180 000 км пробега, в зависимости от того, что наступит раньше. Специалисты Дилерской сети, обладающие необходимыми знаниями и опытом работы, возьмут на себя Техническое Обслуживание Вашего автомобиля и устранение возможных неисправностей, используя только детали, рекомендованные к применению корпорацией Kia. Дилеры ООО «Киа Россия и СНГ» позаботятся о том, чтобы Ваш автомобиль удовлетворял самым высоким требованиям. Корпорация Kia стремится к постоянному совершенствованию своей продукции и в связи с этим оставляет за собой право на изменение условий и положений, упомянутых в данной Сервисной книжке, с предварительным уведомлением об этом или без такого уведомления (в том числе посредством размещения информации на официальном сайте www.kia.ru, в связи с чем просим Вас отслеживать всю необходимую информацию, касающуюся Вашего автомобиля). Корпорация Kia не ограничивается продажей автомобилей, а постоянно стремится к расширению Дилерской сети на территории России, специалисты которой в любой момент готовы оказать Вам квалифицированную помощь и обеспечить необходимыми запасными частями и аксессуарами. Мы берем на себя обязательства обеспечить Вам комфорт при эксплуатации автомобилей Kia на протяжении многих лет. Каждый автомобиль, произведенный корпорацией Kia, покидая стены завода, проходит строгий выходной контроль качества, но тем не менее при передаче Вам автомобиля официальный Дилер должен провести его Предпродажное сервисное обслуживание (далее ПСО). Задачей ПСО является выявление и устранение возможных неисправностей, возникших в процессе транспортировки и хранения автомобиля до момента его продажи. После выполнения ПСО официальный Дилер заверит печатью Бланк ПСО на стр. 24. Внимание! Без проведения Предпродажной подготовки реализация автомобиля запрещена. Официальный Дилер, прежде чем передать Вам автомобиль, должен убедиться в том, что Вы полностью ознакомлены с его устройством и управлением: • объяснить Вам работу всех элементов управления автомобиля и дать возможность проверить их действие; • вписать информацию об автомобиле и его Владельце в соответствующие разделы Сервисной книжки; • убедиться в том, что Вы получили Руководство пользователя и объяснить требования к плановому Техническому Обслуживанию; • объяснить условия гарантийных обязательств корпорации Kia, распространяющиеся на новые автомобили и изложенные в настоящей Сервисной книжке. После ознакомления с вышеуказанной информацией Вам необходимо расписаться в соответствующем разделе Сервисной книжки. Дилер вправе отказать Владельцу автомобиля в гарантийном обслуживании в случае отсутствия подписи Владельца автомобиля на стр. 12 Сервисной книжки, свидетельствующей о том, что с гарантийными обязательствами он ознакомлен, условия предоставления гарантии и правила эксплуатации автомобиля разъяснены и понятны.']","The terms and conditions outlined in the Руководстве по эксплуатации for Kia vehicles include a guarantee of proper functioning of components and assemblies for 5 years (7 years for K900) or 150,000 km mileage, provided the conditions in the manual are followed. The service life of a Kia vehicle is 6 years (7 years for K900) or 180,000 km mileage. Authorized dealers will handle the Technical Maintenance and repair of your vehicle using only parts recommended by Kia. Kia Corporation reserves the right to modify the terms and conditions mentioned in the manual with prior notice or without it, aiming for continuous product improvement.",single_hop_specific_query_synthesizer
What are the warranty conditions for Kia car owners?,"['Сервисная книжка Добро пожаловать в Семью Владельцев автомобилей Kia При выборе автомобиля Вы мечтали о надежном, безопасном, эргономичном и динамичном автомобиле? Ваша мечта сбылась! Все сотрудники корпорации Kia поздравляют Вас с приобретением автомобиля Kia. Вы стали Владельцем автомобиля, который является предметом нашей гордости. Самые новейшие технологии, применяемые в современном автомобилестроении, позволили создать высококачественный автомобиль, который будет доставлять удовольствие самому взыскательному водителю. Мы уверены в том, что автомобиль Kia будет оставаться надежным спутником в Вашей динамичной жизни на протяжении всего срока службы. Уверенность в надежности выпускаемых нами автомобилей позволяет гарантировать исправную работу узлов и агрегатов в течение 5 лет (7 лет для K900) или 150 000 км пробега (в зависимости от того, что наступит ранее) при соблюдении Вами условий, изложенных в Руководстве по эксплуатации автомобиля, и в данной сервисной книжке. Срок службы автомобиля Kia составляет 6 лет (7 лет для K900) или 180 000 км пробега, в зависимости от того, что наступит раньше. Специалисты Дилерской сети, обладающие необходимыми знаниями и опытом работы, возьмут на себя Техническое Обслуживание Вашего автомобиля и устранение возможных неисправностей, используя только детали, рекомендованные к применению корпорацией Kia. Дилеры ООО «Киа Россия и СНГ» позаботятся о том, чтобы Ваш автомобиль удовлетворял самым высоким требованиям. Корпорация Kia стремится к постоянному совершенствованию своей продукции и в связи с этим оставляет за собой право на изменение условий и положений, упомянутых в данной Сервисной книжке, с предварительным уведомлением об этом или без такого уведомления (в том числе посредством размещения информации на официальном сайте www.kia.ru, в связи с чем просим Вас отслеживать всю необходимую информацию, касающуюся Вашего автомобиля). Корпорация Kia не ограничивается продажей автомобилей, а постоянно стремится к расширению Дилерской сети на территории России, специалисты которой в любой момент готовы оказать Вам квалифицированную помощь и обеспечить необходимыми запасными частями и аксессуарами. Мы берем на себя обязательства обеспечить Вам комфорт при эксплуатации автомобилей Kia на протяжении многих лет. Каждый автомобиль, произведенный корпорацией Kia, покидая стены завода, проходит строгий выходной контроль качества, но тем не менее при передаче Вам автомобиля официальный Дилер должен провести его Предпродажное сервисное обслуживание (далее ПСО). Задачей ПСО является выявление и устранение возможных неисправностей, возникших в процессе транспортировки и хранения автомобиля до момента его продажи. После выполнения ПСО официальный Дилер заверит печатью Бланк ПСО на стр. 24. Внимание! Без проведения Предпродажной подготовки реализация автомобиля запрещена. Официальный Дилер, прежде чем передать Вам автомобиль, должен убедиться в том, что Вы полностью ознакомлены с его устройством и управлением: • объяснить Вам работу всех элементов управления автомобиля и дать возможность проверить их действие; • вписать информацию об автомобиле и его Владельце в соответствующие разделы Сервисной книжки; • убедиться в том, что Вы получили Руководство пользователя и объяснить требования к плановому Техническому Обслуживанию; • объяснить условия гарантийных обязательств корпорации Kia, распространяющиеся на новые автомобили и изложенные в настоящей Сервисной книжке. После ознакомления с вышеуказанной информацией Вам необходимо расписаться в соответствующем разделе Сервисной книжки. Дилер вправе отказать Владельцу автомобиля в гарантийном обслуживании в случае отсутствия подписи Владельца автомобиля на стр. 12 Сервисной книжки, свидетельствующей о том, что с гарантийными обязательствами он ознакомлен, условия предоставления гарантии и правила эксплуатации автомобиля разъяснены и понятны.']","The warranty for Kia cars covers the proper functioning of components and assemblies for 5 years (7 years for K900) or 150,000 km mileage, depending on which comes first. The Kia car's service life is 6 years (7 years for K900) or 180,000 km mileage, depending on which comes first. The authorized dealer network specialists will handle the Technical Maintenance of your car and address any possible malfunctions using only parts recommended by Kia. Kia Russia and CIS LLC dealers will ensure that your car meets the highest standards.",single_hop_specific_query_synthesizer
